[
  {
    "w": "cat",
    "zh": "猫",
    "kind": "cvc",
    "e": "🐱"
  },
  {
    "w": "dog",
    "zh": "狗",
    "kind": "cvc",
    "e": "🐶"
  },
  {
    "w": "pup",
    "zh": "小狗",
    "kind": "cvc",
    "e": "🐶"
  },
  {
    "w": "sun",
    "zh": "太阳",
    "kind": "cvc",
    "e": "☀️"
  },
  {
    "w": "mat",
    "zh": "小垫子",
    "kind": "cvc",
    "e": "🧺"
  },
  {
    "w": "hat",
    "zh": "帽子",
    "kind": "cvc",
    "e": "🎩"
  },
  {
    "w": "bat",
    "zh": "蝙蝠",
    "kind": "cvc",
    "e": "🦇"
  },
  {
    "w": "sit",
    "zh": "坐",
    "kind": "cvc",
    "e": "🪑"
  },
  {
    "w": "bit",
    "zh": "一点点",
    "kind": "cvc",
    "e": "🤏"
  },
  {
    "w": "fit",
    "zh": "合身",
    "kind": "cvc",
    "e": "✅"
  },
  {
    "w": "run",
    "zh": "跑",
    "kind": "cvc",
    "e": "🏃"
  },
  {
    "w": "fun",
    "zh": "好玩",
    "kind": "cvc",
    "e": "🎉"
  },
  {
    "w": "bun",
    "zh": "小面包",
    "kind": "cvc",
    "e": "🥖"
  },
  {
    "w": "pen",
    "zh": "笔",
    "kind": "cvc",
    "e": "🖊️"
  },
  {
    "w": "hen",
    "zh": "母鸡",
    "kind": "cvc",
    "e": "🐔"
  },
  {
    "w": "ten",
    "zh": "十",
    "kind": "cvc",
    "e": "🔟"
  },
  {
    "w": "jet",
    "zh": "飞机",
    "kind": "cvc",
    "e": "✈️"
  },
  {
    "w": "net",
    "zh": "网",
    "kind": "cvc",
    "e": "🕸️"
  },
  {
    "w": "wet",
    "zh": "湿的",
    "kind": "cvc",
    "e": "💧"
  },
  {
    "w": "pig",
    "zh": "猪",
    "kind": "cvc",
    "e": "🐷"
  },
  {
    "w": "big",
    "zh": "大的",
    "kind": "cvc",
    "e": "📏"
  },
  {
    "w": "dig",
    "zh": "挖",
    "kind": "cvc",
    "e": "⛏️"
  },
  {
    "w": "log",
    "zh": "木头",
    "kind": "cvc",
    "e": "🪵"
  },
  {
    "w": "fog",
    "zh": "雾",
    "kind": "cvc",
    "e": "🌫️"
  },
  {
    "w": "cup",
    "zh": "杯子",
    "kind": "cvc",
    "e": "☕"
  },
  {
    "w": "mug",
    "zh": "马克杯",
    "kind": "cvc",
    "e": "☕"
  },
  {
    "w": "mud",
    "zh": "泥",
    "kind": "cvc",
    "e": "🟤"
  },
  {
    "w": "bug",
    "zh": "小虫",
    "kind": "cvc",
    "e": "🐛"
  },
  {
    "w": "rug",
    "zh": "小地毯",
    "kind": "cvc",
    "e": "🧶"
  },
  {
    "w": "hug",
    "zh": "抱抱",
    "kind": "cvc",
    "e": "🤗"
  },
  {
    "w": "web",
    "zh": "网",
    "kind": "cvc",
    "e": "🕸️"
  },
  {
    "w": "bed",
    "zh": "床",
    "kind": "cvc",
    "e": "🛏️"
  },
  {
    "w": "red",
    "zh": "红色",
    "kind": "cvc",
    "e": "🔴"
  },
  {
    "w": "map",
    "zh": "地图",
    "kind": "cvc",
    "e": "🗺️"
  },
  {
    "w": "cap",
    "zh": "帽子",
    "kind": "cvc",
    "e": "🧢"
  },
  {
    "w": "nap",
    "zh": "午睡",
    "kind": "cvc",
    "e": "😴"
  },
  {
    "w": "tap",
    "zh": "水龙头",
    "kind": "cvc",
    "e": "🚰"
  },
  {
    "w": "lip",
    "zh": "嘴唇",
    "kind": "cvc",
    "e": "👄"
  },
  {
    "w": "tip",
    "zh": "小提示",
    "kind": "cvc",
    "e": "⬆️"
  },
  {
    "w": "pan",
    "zh": "平底锅",
    "kind": "cvc",
    "e": "🍳"
  },
  {
    "w": "fan",
    "zh": "风扇",
    "kind": "cvc",
    "e": "🌀"
  },
  {
    "w": "man",
    "zh": "叔叔",
    "kind": "cvc",
    "e": "👨"
  },
  {
    "w": "van",
    "zh": "面包车",
    "kind": "cvc",
    "e": "🚐"
  },
  {
    "w": "kid",
    "zh": "小孩",
    "kind": "cvc",
    "e": "🧒"
  },
  {
    "w": "pin",
    "zh": "别针",
    "kind": "cvc",
    "e": "📌"
  },
  {
    "w": "win",
    "zh": "赢",
    "kind": "cvc",
    "e": "🏆"
  },
  {
    "w": "fin",
    "zh": "鱼鳍",
    "kind": "cvc",
    "e": "🐠"
  },
  {
    "w": "tin",
    "zh": "小铁盒",
    "kind": "cvc",
    "e": "🥫"
  },
  {
    "w": "hot",
    "zh": "热的",
    "kind": "cvc",
    "e": "🌶️"
  },
  {
    "w": "pot",
    "zh": "锅",
    "kind": "cvc",
    "e": "🍲"
  },
  {
    "w": "lot",
    "zh": "好多",
    "kind": "cvc",
    "e": "📚"
  },
  {
    "w": "not",
    "zh": "不",
    "kind": "cvc",
    "e": "❌"
  },
  {
    "w": "hop",
    "zh": "跳",
    "kind": "cvc",
    "e": "🦘"
  },
  {
    "w": "top",
    "zh": "上面",
    "kind": "cvc",
    "e": "🔝"
  },
  {
    "w": "sub",
    "zh": "三明治",
    "kind": "cvc",
    "e": "🥪"
  },
  {
    "w": "tub",
    "zh": "浴缸",
    "kind": "cvc",
    "e": "🛁"
  },
  {
    "w": "rub",
    "zh": "擦",
    "kind": "cvc",
    "e": "🧽"
  },
  {
    "w": "bud",
    "zh": "花苞",
    "kind": "cvc",
    "e": "🌱"
  },
  {
    "w": "cub",
    "zh": "幼兽",
    "kind": "cvc",
    "e": "🐻"
  },
  {
    "w": "yet",
    "zh": "还",
    "kind": "cvc",
    "e": "⏳"
  },
  {
    "w": "set",
    "zh": "一套",
    "kind": "cvc",
    "e": "📐"
  },
  {
    "w": "pet",
    "zh": "宠物",
    "kind": "cvc",
    "e": "🐕"
  },
  {
    "w": "let",
    "zh": "让",
    "kind": "cvc",
    "e": "🤝"
  },
  {
    "w": "met",
    "zh": "见到",
    "kind": "cvc",
    "e": "🤝"
  },
  {
    "w": "mop",
    "zh": "拖把",
    "kind": "cvc",
    "e": "🧹"
  },
  {
    "w": "pop",
    "zh": "砰",
    "kind": "cvc",
    "e": "🎈"
  },
  {
    "w": "mom",
    "zh": "妈妈",
    "kind": "cvc",
    "e": "👩"
  },
  {
    "w": "dad",
    "zh": "爸爸",
    "kind": "cvc",
    "e": "👨"
  },
  {
    "w": "pad",
    "zh": "本子",
    "kind": "cvc",
    "e": "📝"
  },
  {
    "w": "bad",
    "zh": "不好",
    "kind": "cvc",
    "e": "👎"
  },
  {
    "w": "sad",
    "zh": "难过",
    "kind": "cvc",
    "e": "😢"
  },
  {
    "w": "mad",
    "zh": "生气",
    "kind": "cvc",
    "e": "😠"
  },
  {
    "w": "tag",
    "zh": "标签",
    "kind": "cvc",
    "e": "🏷️"
  },
  {
    "w": "rag",
    "zh": "抹布",
    "kind": "cvc",
    "e": "🧺"
  },
  {
    "w": "wag",
    "zh": "摇尾巴",
    "kind": "cvc",
    "e": "🐕"
  },
  {
    "w": "jog",
    "zh": "慢跑",
    "kind": "cvc",
    "e": "👟"
  },
  {
    "w": "hog",
    "zh": "猪",
    "kind": "cvc",
    "e": "🐖"
  },
  {
    "w": "cob",
    "zh": "玉米",
    "kind": "cvc",
    "e": "🌽"
  },
  {
    "w": "job",
    "zh": "事情",
    "kind": "cvc",
    "e": "💼"
  },
  {
    "w": "gum",
    "zh": "口香糖",
    "kind": "cvc",
    "e": "🍬"
  },
  {
    "w": "hum",
    "zh": "哼哼唱",
    "kind": "cvc",
    "e": "🎵"
  },
  {
    "w": "sum",
    "zh": "加在一起",
    "kind": "cvc",
    "e": "➕"
  },
  {
    "w": "yum",
    "zh": "好吃",
    "kind": "cvc",
    "e": "😋"
  },
  {
    "w": "box",
    "zh": "盒子",
    "kind": "cvc",
    "e": "📦"
  },
  {
    "w": "fox",
    "zh": "狐狸",
    "kind": "cvc",
    "e": "🦊"
  },
  {
    "w": "six",
    "zh": "六",
    "kind": "cvc",
    "e": "6️⃣"
  },
  {
    "w": "mix",
    "zh": "拌在一起",
    "kind": "cvc",
    "e": "🔄"
  },
  {
    "w": "fix",
    "zh": "修好",
    "kind": "cvc",
    "e": "🔧"
  },
  {
    "w": "wax",
    "zh": "蜡笔那种蜡",
    "kind": "cvc",
    "e": "🕯️"
  },
  {
    "w": "zip",
    "zh": "拉链",
    "kind": "cvc",
    "e": "🤐"
  },
  {
    "w": "rip",
    "zh": "撕开",
    "kind": "cvc",
    "e": "📄"
  },
  {
    "w": "sip",
    "zh": "小口喝",
    "kind": "cvc",
    "e": "☕"
  },
  {
    "w": "yam",
    "zh": "红薯",
    "kind": "cvc",
    "e": "🍠"
  },
  {
    "w": "lab",
    "zh": "实验角",
    "kind": "cvc",
    "e": "🧪"
  },
  {
    "w": "dug",
    "zh": "挖过",
    "kind": "cvc",
    "e": "⛏️"
  },
  {
    "w": "jug",
    "zh": "水壶",
    "kind": "cvc",
    "e": "🫙"
  },
  {
    "w": "rid",
    "zh": "去掉",
    "kind": "cvc",
    "e": "🧹"
  },
  {
    "w": "hid",
    "zh": "藏起来",
    "kind": "cvc",
    "e": "🙈"
  },
  {
    "w": "lid",
    "zh": "盖子",
    "kind": "cvc",
    "e": "🫙"
  },
  {
    "w": "kit",
    "zh": "小套装",
    "kind": "cvc",
    "e": "🧰"
  },
  {
    "w": "pit",
    "zh": "坑",
    "kind": "cvc",
    "e": "🕳️"
  },
  {
    "w": "ram",
    "zh": "公羊",
    "kind": "cvc",
    "e": "🐏"
  },
  {
    "w": "cab",
    "zh": "出租车",
    "kind": "cvc",
    "e": "🚕"
  },
  {
    "w": "ham",
    "zh": "火腿",
    "kind": "cvc",
    "e": "🍖"
  },
  {
    "w": "jam",
    "zh": "果酱",
    "kind": "cvc",
    "e": "🍓"
  },
  {
    "w": "sag",
    "zh": "垂下来",
    "kind": "cvc",
    "e": "📉"
  },
  {
    "w": "tan",
    "zh": "晒成棕色",
    "kind": "cvc",
    "e": "☀️"
  },
  {
    "w": "nod",
    "zh": "点头",
    "kind": "cvc",
    "e": "👍"
  },
  {
    "w": "tot",
    "zh": "小宝宝",
    "kind": "cvc",
    "e": "👶"
  },
  {
    "w": "rib",
    "zh": "肋骨边",
    "kind": "cvc",
    "e": "🦴"
  },
  {
    "w": "rod",
    "zh": "小棍",
    "kind": "cvc",
    "e": "🪄"
  },
  {
    "w": "rot",
    "zh": "烂掉",
    "kind": "cvc",
    "e": "🍎"
  },
  {
    "w": "zig",
    "zh": "之字形",
    "kind": "cvc",
    "e": "⚡"
  },
  {
    "w": "the",
    "zh": "这个；那个",
    "kind": "sight",
    "e": "📝"
  },
  {
    "w": "a",
    "zh": "一个",
    "kind": "sight",
    "e": "🔤"
  },
  {
    "w": "i",
    "zh": "我",
    "kind": "sight",
    "e": "🙋"
  },
  {
    "w": "at",
    "zh": "在",
    "kind": "sight",
    "e": "📍"
  },
  {
    "w": "it",
    "zh": "它",
    "kind": "sight",
    "e": "👉"
  },
  {
    "w": "and",
    "zh": "和",
    "kind": "sight",
    "e": "➕"
  },
  {
    "w": "was",
    "zh": "曾经是",
    "kind": "sight",
    "e": "⏮️"
  },
  {
    "w": "to",
    "zh": "去",
    "kind": "sight",
    "e": "➡️"
  },
  {
    "w": "in",
    "zh": "在…里",
    "kind": "sight",
    "e": "📥"
  },
  {
    "w": "is",
    "zh": "是",
    "kind": "sight",
    "e": "💚"
  },
  {
    "w": "you",
    "zh": "你",
    "kind": "sight",
    "e": "👋"
  },
  {
    "w": "on",
    "zh": "在…上",
    "kind": "sight",
    "e": "🔛"
  },
  {
    "w": "can",
    "zh": "能",
    "kind": "sight",
    "e": "💪"
  },
  {
    "w": "he",
    "zh": "他",
    "kind": "sight",
    "e": "👦"
  },
  {
    "w": "we",
    "zh": "我们",
    "kind": "sight",
    "e": "👫"
  },
  {
    "w": "me",
    "zh": "我",
    "kind": "sight",
    "e": "🙋"
  },
  {
    "w": "my",
    "zh": "我的",
    "kind": "sight",
    "e": "⭐"
  },
  {
    "w": "no",
    "zh": "不",
    "kind": "sight",
    "e": "🙅"
  },
  {
    "w": "so",
    "zh": "这么",
    "kind": "sight",
    "e": "✨"
  },
  {
    "w": "up",
    "zh": "向上",
    "kind": "sight",
    "e": "⬆️"
  },
  {
    "w": "go",
    "zh": "去",
    "kind": "sight",
    "e": "🚶"
  },
  {
    "w": "do",
    "zh": "做",
    "kind": "sight",
    "e": "✅"
  },
  {
    "w": "am",
    "zh": "我是",
    "kind": "sight",
    "e": "🧒"
  },
  {
    "w": "an",